<!ELEMENT fruteria (fruta+)>
<!ELEMENT fruta (codigo, tipo , color , arbol , proveniencia , clasificacion , cultivo)>
<!ELEMENT codigo (#PCDATA)>
<!ELEMENT tipo (#PCDATA)>
<!ELEMENT color (#PCDATA)>
<!ELEMENT arbol (#PCDATA)>
<!ELEMENT proveniencia (#PCDATA)>
<!ELEMENT clasificacion (#PCDATA)>
<!ELEMENT cultivo (#PCDATA)>